ID, Job Title, Company, Location, Date Posted, Summary, URL
1, Software Engineer, TechCorp, Lahore, 2024-06-01, Develop and maintain software applications., https://www.indeed.com/viewjob?jk=1234567890
2, Data Scientist, DataSolutions, Lahore, 2024-05-28, Analyze and interpret complex data sets., https://www.indeed.com/viewjob?jk=0987654321
3, Frontend Developer, WebWorks, Lahore, 2024-06-03, Create stunning user interfaces., https://www.indeed.com/viewjob?jk=1122334455
4, Backend Developer, ServerSide Inc, Lahore, 2024-05-30, Build and optimize server-side logic., https://www.indeed.com/viewjob?jk=6677889900
5, DevOps Engineer, CloudNet, Lahore, 2024-06-02, Manage and automate cloud infrastructure., https://www.indeed.com/viewjob?jk=5544332211
